{
  "id": "item_sinew_lashing",
  "type": "item",
  "name": "Sinew lashing",
  "base_item": "item_cordage",
  "kind": "tool",
  "affords": [
    "bind"
  ],
  "materials": [
    "material_sinew"
  ],
  "notes": "Dries tight rather than merely holding, which is why every hafted thing that must not loosen -- a spear, a harpoon, a bow -- wants it. A twisted fibre cord will haft an adze or string a bow drill well enough to start with, and has to be retied; this does not.",
  "canon": "inferred",
  "sources": [
    "inferred from canon geography"
  ],
  "source_index": 8
}
