{
  "id": "item_dried_fish",
  "type": "item",
  "name": "Dried fish",
  "base_item": "item_prepared_food",
  "kind": "food",
  "affords": [
    "eat",
    "trade"
  ],
  "materials": [
    "material_river_fish",
    "material_salt_crust"
  ],
  "notes": "Split, salted, racked. Keeps a season and travels anywhere.",
  "canon": "inferred",
  "sources": [
    "inferred from canon geography"
  ],
  "source_index": 48
}
