{
  "id": "item_bedroll",
  "type": "item",
  "name": "Bedroll",
  "kind": "shelter",
  "affords": [
    "shelter"
  ],
  "materials": [
    "material_reed_fibre",
    "material_deer_hide",
    "material_tree_pitch"
  ],
  "notes": "Oiled cloth over a reed mat, rolled and strapped under the satchel. It has been rained on. **The game has carried this from its first step.** Affords shelter and nothing else: a bedroll strapped under a satchel is a thing being carried, not a thing that carries.",
  "canon": "inferred",
  "sources": [
    "inferred from canon geography"
  ],
  "source_index": 58
}
